{
 "schema": "magview.handoff",
 "schema_version": "1.0",
 "created_utc": "2026-10-09T12:33:41+00:00",
 "generator": {
  "name": "MagView",
  "version": "0.0.1"
 },
 "source": {
  "file": "/workspace/magview/tests/data/Cs3V9Te13_300K.cif",
  "sha256": "b7d6cfb5df10799ad8c2c4e8cbfb7d0159c8c077b4322a692455d010a88cc411",
  "formula": "Cs3V9Te13",
  "space_group": {
   "number": 189,
   "symbol": "P-62m"
  }
 },
 "input_cell": {
  "lattice": [
   [
    10.089,
    0.0,
    6.177730778298823e-16
   ],
   [
    -5.0444999999999975,
    8.737330298781204,
    6.177730778298823e-16
   ],
   [
    0.0,
    0.0,
    8.212
   ]
  ],
  "species": [
   "Cs",
   "Cs",
   "Cs",
   "V",
   "V",
   "V",
   "V",
   "V",
   "V",
   "V",
   "V",
   "V",
   "Te",
   "Te",
   "Te",
   "Te",
   "Te",
   "Te",
   "Te",
   "Te",
   "Te",
   "Te",
   "Te",
   "Te",
   "Te"
  ],
  "frac_coords": [
   [
    0.36401,
    0.36401,
    0.0
   ],
   [
    0.0,
    0.63599,
    0.0
   ],
   [
    0.63599,
    0.0,
    0.0
   ],
   [
    0.1555,
    0.1555,
    0.5
   ],
   [
    0.0,
    0.8445,
    0.5
   ],
   [
    0.8445,
    0.0,
    0.5
   ],
   [
    0.821,
    0.2866,
    0.5
   ],
   [
    0.4656,
    0.179,
    0.5
   ],
   [
    0.7134,
    0.5344,
    0.5
   ],
   [
    0.2866,
    0.821,
    0.5
   ],
   [
    0.5344,
    0.7134,
    0.5
   ],
   [
    0.179,
    0.4656,
    0.5
   ],
   [
    0.6666666667,
    0.3333333333,
    0.25265
   ],
   [
    0.6666666667,
    0.3333333333,
    0.74735
   ],
   [
    0.3333333333,
    0.6666666667,
    0.25265
   ],
   [
    0.3333333333,
    0.6666666667,
    0.74735
   ],
   [
    0.0,
    0.22819,
    0.71992
   ],
   [
    0.22819,
    0.0,
    0.28008
   ],
   [
    0.77181,
    0.77181,
    0.71992
   ],
   [
    0.0,
    0.22819,
    0.28008
   ],
   [
    0.22819,
    0.0,
    0.71992
   ],
   [
    0.77181,
    0.77181,
    0.28008
   ],
   [
    0.41185,
    0.41185,
    0.5
   ],
   [
    0.0,
    0.58815,
    0.5
   ],
   [
    0.58815,
    0.0,
    0.5
   ]
  ],
  "labels": [
   "Cs1",
   "Cs1",
   "Cs1",
   "V1",
   "V1",
   "V1",
   "V2",
   "V2",
   "V2",
   "V2",
   "V2",
   "V2",
   "Te1",
   "Te1",
   "Te1",
   "Te1",
   "Te2",
   "Te2",
   "Te2",
   "Te2",
   "Te2",
   "Te2",
   "Te3",
   "Te3",
   "Te3"
  ]
 },
 "reference_cell": {
  "lattice": [
   [
    10.089,
    0.0,
    6.177730778298823e-16
   ],
   [
    -5.0444999999999975,
    8.737330298781204,
    6.177730778298823e-16
   ],
   [
    0.0,
    0.0,
    8.212
   ]
  ],
  "species": [
   "Cs",
   "Cs",
   "Cs",
   "V",
   "V",
   "V",
   "V",
   "V",
   "V",
   "V",
   "V",
   "V",
   "Te",
   "Te",
   "Te",
   "Te",
   "Te",
   "Te",
   "Te",
   "Te",
   "Te",
   "Te",
   "Te",
   "Te",
   "Te"
  ],
  "frac_coords": [
   [
    0.36401,
    0.36401,
    0.0
   ],
   [
    0.0,
    0.63599,
    0.0
   ],
   [
    0.63599,
    0.0,
    0.0
   ],
   [
    0.1555,
    0.1555,
    0.5
   ],
   [
    0.0,
    0.8445,
    0.5
   ],
   [
    0.8445,
    0.0,
    0.5
   ],
   [
    0.821,
    0.2866,
    0.5
   ],
   [
    0.4656,
    0.179,
    0.5
   ],
   [
    0.7134,
    0.5344,
    0.5
   ],
   [
    0.2866,
    0.821,
    0.5
   ],
   [
    0.5344,
    0.7134,
    0.5
   ],
   [
    0.179,
    0.4656,
    0.5
   ],
   [
    0.6666666667,
    0.3333333333,
    0.25265
   ],
   [
    0.6666666667,
    0.3333333333,
    0.74735
   ],
   [
    0.3333333333,
    0.6666666667,
    0.25265
   ],
   [
    0.3333333333,
    0.6666666667,
    0.74735
   ],
   [
    0.0,
    0.22819,
    0.71992
   ],
   [
    0.22819,
    0.0,
    0.28008
   ],
   [
    0.77181,
    0.77181,
    0.71992
   ],
   [
    0.0,
    0.22819,
    0.28008
   ],
   [
    0.22819,
    0.0,
    0.71992
   ],
   [
    0.77181,
    0.77181,
    0.28008
   ],
   [
    0.41185,
    0.41185,
    0.5
   ],
   [
    0.0,
    0.58815,
    0.5
   ],
   [
    0.58815,
    0.0,
    0.5
   ]
  ],
  "labels": [
   "Cs1",
   "Cs1",
   "Cs1",
   "V1",
   "V1",
   "V1",
   "V2",
   "V2",
   "V2",
   "V2",
   "V2",
   "V2",
   "Te1",
   "Te1",
   "Te1",
   "Te1",
   "Te2",
   "Te2",
   "Te2",
   "Te2",
   "Te2",
   "Te2",
   "Te3",
   "Te3",
   "Te3"
  ],
  "description": "input cell (already primitive)",
  "parent_input_site": [
   0,
   1,
   2,
   3,
   4,
   5,
   6,
   7,
   8,
   9,
   10,
   11,
   12,
   13,
   14,
   15,
   16,
   17,
   18,
   19,
   20,
   21,
   22,
   23,
   24
  ]
 },
 "magnetic_cell": {
  "lattice": [
   [
    10.089,
    0.0,
    6.177730778298823e-16
   ],
   [
    -5.0444999999999975,
    8.737330298781204,
    6.177730778298823e-16
   ],
   [
    0.0,
    0.0,
    8.212
   ]
  ],
  "species": [
   "Cs",
   "Cs",
   "Cs",
   "V",
   "V",
   "V",
   "V",
   "V",
   "V",
   "V",
   "V",
   "V",
   "Te",
   "Te",
   "Te",
   "Te",
   "Te",
   "Te",
   "Te",
   "Te",
   "Te",
   "Te",
   "Te",
   "Te",
   "Te"
  ],
  "frac_coords": [
   [
    0.36401,
    0.36401,
    0.0
   ],
   [
    0.0,
    0.63599,
    0.0
   ],
   [
    0.63599,
    0.0,
    0.0
   ],
   [
    0.1555,
    0.1555,
    0.5
   ],
   [
    0.0,
    0.8445,
    0.5
   ],
   [
    0.8445,
    0.0,
    0.5
   ],
   [
    0.821,
    0.2866,
    0.5
   ],
   [
    0.4656,
    0.179,
    0.5
   ],
   [
    0.7134,
    0.5344,
    0.5
   ],
   [
    0.2866,
    0.821,
    0.5
   ],
   [
    0.5344,
    0.7134,
    0.5
   ],
   [
    0.179,
    0.4656,
    0.5
   ],
   [
    0.6666666667,
    0.3333333333,
    0.25265
   ],
   [
    0.6666666667,
    0.3333333333,
    0.74735
   ],
   [
    0.3333333333,
    0.6666666667,
    0.25265
   ],
   [
    0.3333333333,
    0.6666666667,
    0.74735
   ],
   [
    0.0,
    0.22819,
    0.71992
   ],
   [
    0.22819,
    0.0,
    0.28008
   ],
   [
    0.77181,
    0.77181,
    0.71992
   ],
   [
    0.0,
    0.22819,
    0.28008
   ],
   [
    0.22819,
    0.0,
    0.71992
   ],
   [
    0.77181,
    0.77181,
    0.28008
   ],
   [
    0.41185,
    0.41185,
    0.5
   ],
   [
    0.0,
    0.58815,
    0.5
   ],
   [
    0.58815,
    0.0,
    0.5
   ]
  ],
  "labels": [
   "Cs1",
   "Cs1",
   "Cs1",
   "V1",
   "V1",
   "V1",
   "V2",
   "V2",
   "V2",
   "V2",
   "V2",
   "V2",
   "Te1",
   "Te1",
   "Te1",
   "Te1",
   "Te2",
   "Te2",
   "Te2",
   "Te2",
   "Te2",
   "Te2",
   "Te3",
   "Te3",
   "Te3"
  ],
  "parent_input_site": [
   0,
   1,
   2,
   3,
   4,
   5,
   6,
   7,
   8,
   9,
   10,
   11,
   12,
   13,
   14,
   15,
   16,
   17,
   18,
   19,
   20,
   21,
   22,
   23,
   24
  ]
 },
 "supercell_matrix": [
  [
   1,
   0,
   0
  ],
  [
   0,
   1,
   0
  ],
  [
   0,
   0,
   1
  ]
 ],
 "supercell_matrix_input": [
  [
   1,
   0,
   0
  ],
  [
   0,
   1,
   0
  ],
  [
   0,
   0,
   1
  ]
 ],
 "multiplicity": 1,
 "canvas_matrix": [
  [
   2,
   0,
   0
  ],
  [
   0,
   2,
   0
  ],
  [
   0,
   0,
   2
  ]
 ],
 "moments": {
  "frame": "cartesian",
  "unit": "mu_B",
  "vectors": [
   [
    0.0,
    0.0,
    0.0
   ],
   [
    0.0,
    0.0,
    0.0
   ],
   [
    0.0,
    0.0,
    0.0
   ],
   [
    0.0,
    0.0,
    2.4
   ],
   [
    0.0,
    0.0,
    2.4
   ],
   [
    0.0,
    0.0,
    2.4
   ],
   [
    0.0,
    0.0,
    2.4
   ],
   [
    0.0,
    0.0,
    2.4
   ],
   [
    0.0,
    0.0,
    2.4
   ],
   [
    0.0,
    0.0,
    2.4
   ],
   [
    0.0,
    0.0,
    2.4
   ],
   [
    0.0,
    0.0,
    2.4
   ],
   [
    0.0,
    0.0,
    0.0
   ],
   [
    0.0,
    0.0,
    0.0
   ],
   [
    0.0,
    0.0,
    0.0
   ],
   [
    0.0,
    0.0,
    0.0
   ],
   [
    0.0,
    0.0,
    0.0
   ],
   [
    0.0,
    0.0,
    0.0
   ],
   [
    0.0,
    0.0,
    0.0
   ],
   [
    0.0,
    0.0,
    0.0
   ],
   [
    0.0,
    0.0,
    0.0
   ],
   [
    0.0,
    0.0,
    0.0
   ],
   [
    0.0,
    0.0,
    0.0
   ],
   [
    0.0,
    0.0,
    0.0
   ],
   [
    0.0,
    0.0,
    0.0
   ]
  ],
  "collinear": true,
  "spin_axis": [
   0.0,
   0.0,
   1.0
  ],
  "signed_magnitudes": [
   0.0,
   0.0,
   0.0,
   2.4,
   2.4,
   2.4,
   2.4,
   2.4,
   2.4,
   2.4,
   2.4,
   2.4,
   0.0,
   0.0,
   0.0,
   0.0,
   0.0,
   0.0,
   0.0,
   0.0,
   0.0,
   0.0,
   0.0,
   0.0,
   0.0
  ]
 },
 "patterns": {
  "labels": [
   "V layers: unclassified net (unsupported)",
   "V stacking along c: FM stacking"
  ],
  "stacking_axis": "c",
  "layers": [
   {
    "element": "V",
    "index": 0,
    "height_A": 4.106,
    "lattice": "unsupported",
    "pattern": null,
    "relation_to_layer0": 1
   },
   {
    "element": "V",
    "index": 1,
    "height_A": 12.318,
    "lattice": "unsupported",
    "pattern": null,
    "relation_to_layer0": 1
   }
  ]
 },
 "magnetic_symmetry": {
  "uni_number": 1451,
  "msg_type": 1,
  "n_operations": 12,
  "primitive_volume": 723.8953992567222
 },
 "requires_unfolding": false,
 "unfolding": null,
 "explanation": [
  "The chemical cell suffices: every lattice translation leaves all moments unchanged."
 ],
 "dft_hints": {
  "vasp": {
   "ISPIN": 2,
   "LNONCOLLINEAR": false,
   "MAGMOM": "3*0 9*2.4 13*0",
   "note": "MAGMOM entries follow magnetic_cell site order (POSCAR order). For spin-orbit runs set SAXIS to moments.spin_axis.",
   "species_order": [
    "Cs",
    "V",
    "Te"
   ],
   "species_counts": [
    3,
    9,
    13
   ]
  }
 }
}